{
  "$schema": "https://json-schema.org/draft/2020-12/schema",
  "$id": "https://frontier.invalid/schemas/scenario-v1.json",
  "title": "Frontier scenario v1",
  "type": "object",
  "additionalProperties": false,
  "required": ["scenario_format_version", "scenario_id", "title", "description", "player_faction_id", "regions", "unit_groups", "objectives", "cinematics", "sequences"],
  "properties": {
    "scenario_format_version": { "const": 1 },
    "scenario_id": { "$ref": "#/$defs/id" },
    "title": { "type": "string", "minLength": 1 },
    "description": { "type": "string" },
    "player_faction_id": { "$ref": "#/$defs/id" },
    "visibility": { "type":"object", "additionalProperties":false, "required":["fog_enabled","explored_radius_m","hidden_by_default"], "properties":{"fog_enabled":{"type":"boolean"},"explored_radius_m":{"type":"number","exclusiveMinimum":0},"hidden_by_default":{"type":"boolean"}} },
    "regions": { "type": "array", "items": { "$ref": "#/$defs/region" } },
    "unit_groups": { "type": "array", "items": { "$ref": "#/$defs/group" } },
    "objectives": { "type": "array", "items": { "$ref": "#/$defs/objective" } },
    "tutorials": { "type": "array", "items": { "$ref": "#/$defs/tutorial" } },
    "encounters": { "type": "array", "items": { "$ref": "#/$defs/encounter" } },
    "cinematics": { "type": "array", "items": { "$ref": "#/$defs/cinematic" } },
    "sequences": { "type": "array", "items": { "$ref": "#/$defs/sequence" } }
  },
  "$defs": {
    "id": { "type": "string", "pattern": "^[a-z][a-z0-9_]*$" },
    "vector3": { "type": "array", "prefixItems": [{"type":"number"},{"type":"number"},{"type":"number"}], "items": false, "minItems": 3, "maxItems": 3 },
    "region": {
      "type": "object", "additionalProperties": false,
      "required": ["region_id", "display_name", "shape", "points"],
      "properties": { "region_id":{"$ref":"#/$defs/id"}, "display_name":{"type":"string","minLength":1}, "shape":{"enum":["point","rectangle","path"]}, "points":{"type":"array","items":{"$ref":"#/$defs/vector3"},"minItems":1} }
    },
    "group": {
      "type":"object", "additionalProperties":false, "required":["group_id","instance_ids"],
      "properties":{"group_id":{"$ref":"#/$defs/id"},"instance_ids":{"type":"array","items":{"$ref":"#/$defs/id"},"minItems":1,"uniqueItems":true}}
    },
    "objective": {
      "type":"object", "additionalProperties":false, "required":["objective_id","title","kind","initial_state"],
      "properties":{"objective_id":{"$ref":"#/$defs/id"},"title":{"type":"string","minLength":1},"kind":{"enum":["main","optional"]},"initial_state":{"enum":["hidden","active"]},"steps":{"type":"array","items":{"$ref":"#/$defs/objective_step"}}}
    },
    "objective_step": {
      "type":"object", "additionalProperties":false, "required":["step_id","title"],
      "properties":{"step_id":{"$ref":"#/$defs/id"},"title":{"type":"string","minLength":1},"checkpoint_region_id":{"$ref":"#/$defs/id"}}
    },
    "tutorial": {
      "type":"object", "additionalProperties":false, "required":["tutorial_id","text","control","indicator","acknowledgement"],
      "properties":{"tutorial_id":{"$ref":"#/$defs/id"},"text":{"type":"string","minLength":1},"control":{"enum":["select","move","camera","group","attack","ability"]},"indicator":{"enum":["viewport","world","both"]},"acknowledgement":{"enum":["automatic","input"]},"region_id":{"$ref":"#/$defs/id"},"highlight":{"type":"string"},"gates_sequence_id":{"$ref":"#/$defs/id"}}
    },
    "encounter": {
      "type":"object", "additionalProperties":false, "required":["encounter_id","group_id","initial_state","behavior","leash_region_id","completion","reinforcement_group_ids"],
      "properties":{"encounter_id":{"$ref":"#/$defs/id"},"group_id":{"$ref":"#/$defs/id"},"initial_state":{"enum":["inactive","active"]},"behavior":{"enum":["guard","sleep","patrol","attack","leash"]},"leash_region_id":{"$ref":"#/$defs/id"},"patrol_path_region_id":{"$ref":"#/$defs/id"},"completion":{"const":"all_defeated"},"reinforcement_group_ids":{"type":"array","items":{"$ref":"#/$defs/id"},"uniqueItems":true}}
    },
    "cinematic": {
      "type":"object", "additionalProperties":false, "required":["cinematic_id","skippable","steps"],
      "properties":{"cinematic_id":{"$ref":"#/$defs/id"},"skippable":{"type":"boolean"},"letterbox":{"type":"boolean"},"control_lock":{"type":"boolean"},"steps":{"type":"array","items":{"$ref":"#/$defs/typed"}}}
    },
    "typed": {
      "type":"object", "required":["type"], "properties":{"type":{"type":"string"}}, "additionalProperties":true
    },
    "sequence": {
      "type":"object", "additionalProperties":false, "required":["sequence_id","enabled","one_shot","event","conditions","actions"],
      "properties":{"sequence_id":{"$ref":"#/$defs/id"},"enabled":{"type":"boolean"},"one_shot":{"type":"boolean"},"event":{"$ref":"#/$defs/typed"},"conditions":{"type":"array","items":{"$ref":"#/$defs/typed"}},"actions":{"type":"array","items":{"$ref":"#/$defs/typed"},"minItems":1}}
    }
  }
}
