{"cinematics":[],"description":"Shared conformance fixture","objectives":[{"initial_state":"active","kind":"main","objective_id":"reach_beacon","title":"Reach the beacon"}],"player_faction_id":"frontier_company","regions":[{"display_name":"Beacon","points":[[2,0,3]],"region_id":"beacon","shape":"point"}],"scenario_format_version":1,"scenario_id":"tiny_guided_path","sequences":[{"actions":[{"objective_id":"reach_beacon","state":"completed","type":"set_objective"},{"result":"victory","type":"complete_scenario"}],"conditions":[{"objective_id":"reach_beacon","state":"active","type":"objective_is"}],"enabled":true,"event":{"group_id":"player_party","region_id":"beacon","type":"unit_enters_region"},"one_shot":true,"sequence_id":"reach_beacon"}],"title":"Tiny Guided Path","unit_groups":[{"group_id":"player_party","instance_ids":["crimsdale_guard_001"]}]}
